{"schema_version":2,"id":"DFL-MAT-J03WN1-49484","match_id":"DFL-MAT-J03WN1","period":1,"clock":"26:16","frames":[{"t":0.0,"ball":{"x":41.4,"y":31.6},"players":[{"pid":"A1","num":1,"team":"att","x":9.1,"y":34.4},{"pid":"A4","num":4,"team":"att","x":28.4,"y":33.5},{"pid":"A9","num":9,"team":"att","x":52.4,"y":37.1},{"pid":"A11","num":11,"team":"att","x":40.5,"y":48.6},{"pid":"A19","num":19,"team":"att","x":41.6,"y":33.9},{"pid":"A5","num":5,"team":"att","x":36.7,"y":52.8},{"pid":"A12","num":12,"team":"att","x":29.2,"y":45.5},{"pid":"A25","num":25,"team":"att","x":39.3,"y":35.7},{"pid":"A30","num":30,"team":"att","x":56.5,"y":14.5},{"pid":"A27","num":27,"team":"att","x":59.0,"y":23.7},{"pid":"D1","num":1,"team":"def","x":86.7,"y":36.7},{"pid":"D7","num":7,"team":"def","x":43.2,"y":48.7},{"pid":"D33","num":33,"team":"def","x":29.5,"y":32.7},{"pid":"D30","num":30,"team":"def","x":60.4,"y":28.2},{"pid":"D8","num":8,"team":"def","x":42.4,"y":34.1},{"pid":"D20","num":20,"team":"def","x":57.7,"y":43.6},{"pid":"D23","num":23,"team":"def","x":48.9,"y":44.1},{"pid":"D11","num":11,"team":"def","x":34.2,"y":48.0},{"pid":"D10","num":10,"team":"def","x":43.6,"y":37.3},{"pid":"D22","num":22,"team":"def","x":55.2,"y":21.4},{"pid":"D4","num":4,"team":"def","x":59.6,"y":36.2}]},{"t":0.1,"ball":{"x":41.4,"y":30.5},"players":[{"pid":"A1","num":1,"team":"att","x":9.3,"y":34.4},{"pid":"A4","num":4,"team":"att","x":28.6,"y":33.2},{"pid":"A9","num":9,"team":"att","x":52.7,"y":37.0},{"pid":"A11","num":11,"team":"att","x":40.6,"y":48.5},{"pid":"A19","num":19,"team":"att","x":41.7,"y":33.1},{"pid":"A5","num":5,"team":"att","x":37.0,"y":52.7},{"pid":"A12","num":12,"team":"att","x":29.4,"y":45.4},{"pid":"A25","num":25,"team":"att","x":39.4,"y":35.6},{"pid":"A30","num":30,"team":"att","x":56.9,"y":14.1},{"pid":"A27","num":27,"team":"att","x":59.2,"y":23.3},{"pid":"D1","num":1,"team":"def","x":86.8,"y":36.7},{"pid":"D7","num":7,"team":"def","x":43.4,"y":48.5},{"pid":"D33","num":33,"team":"def","x":29.8,"y":32.7},{"pid":"D30","num":30,"team":"def","x":60.6,"y":27.8},{"pid":"D8","num":8,"team":"def","x":42.3,"y":33.6},{"pid":"D20","num":20,"team":"def","x":57.9,"y":43.2},{"pid":"D23","num":23,"team":"def","x":49.3,"y":44.0},{"pid":"D11","num":11,"team":"def","x":34.5,"y":47.8},{"pid":"D10","num":10,"team":"def","x":43.8,"y":36.8},{"pid":"D22","num":22,"team":"def","x":55.5,"y":21.1},{"pid":"D4","num":4,"team":"def","x":59.9,"y":36.0}]},{"t":0.2,"ball":{"x":41.4,"y":29.4},"players":[{"pid":"A1","num":1,"team":"att","x":9.4,"y":34.3},{"pid":"A4","num":4,"team":"att","x":28.9,"y":33.0},{"pid":"A9","num":9,"team":"att","x":53.1,"y":36.8},{"pid":"A11","num":11,"team":"att","x":40.8,"y":48.3},{"pid":"A19","num":19,"team":"att","x":41.7,"y":32.3},{"pid":"A5","num":5,"team":"att","x":37.3,"y":52.6},{"pid":"A12","num":12,"team":"att","x":29.7,"y":45.2},{"pid":"A25","num":25,"team":"att","x":39.4,"y":35.4},{"pid":"A30","num":30,"team":"att","x":57.2,"y":13.8},{"pid":"A27","num":27,"team":"att","x":59.5,"y":23.0},{"pid":"D1","num":1,"team":"def","x":87.0,"y":36.6},{"pid":"D7","num":7,"team":"def","x":43.7,"y":48.2},{"pid":"D33","num":33,"team":"def","x":30.0,"y":32.6},{"pid":"D30","num":30,"team":"def","x":60.8,"y":27.3},{"pid":"D8","num":8,"team":"def","x":42.2,"y":33.0},{"pid":"D20","num":20,"team":"def","x":58.2,"y":42.9},{"pid":"D23","num":23,"team":"def","x":49.7,"y":43.9},{"pid":"D11","num":11,"team":"def","x":34.8,"y":47.6},{"pid":"D10","num":10,"team":"def","x":43.9,"y":36.3},{"pid":"D22","num":22,"team":"def","x":55.8,"y":20.8},{"pid":"D4","num":4,"team":"def","x":60.3,"y":35.7}]},{"t":0.3,"ball":{"x":41.4,"y":28.4},"players":[{"pid":"A1","num":1,"team":"att","x":9.6,"y":34.2},{"pid":"A4","num":4,"team":"att","x":29.1,"y":32.8},{"pid":"A9","num":9,"team":"att","x":53.4,"y":36.6},{"pid":"A11","num":11,"team":"att","x":40.9,"y":48.2},{"pid":"A19","num":19,"team":"att","x":41.7,"y":31.6},{"pid":"A5","num":5,"team":"att","x":37.6,"y":52.5},{"pid":"A12","num":12,"team":"att","x":29.9,"y":45.1},{"pid":"A25","num":25,"team":"att","x":39.5,"y":35.3},{"pid":"A30","num":30,"team":"att","x":57.5,"y":13.4},{"pid":"A27","num":27,"team":"att","x":59.7,"y":22.6},{"pid":"D1","num":1,"team":"def","x":87.1,"y":36.5},{"pid":"D7","num":7,"team":"def","x":43.9,"y":48.0},{"pid":"D33","num":33,"team":"def","x":30.2,"y":32.6},{"pid":"D30","num":30,"team":"def","x":61.0,"y":26.9},{"pid":"D8","num":8,"team":"def","x":42.2,"y":32.5},{"pid":"D20","num":20,"team":"def","x":58.4,"y":42.5},{"pid":"D23","num":23,"team":"def","x":50.2,"y":43.8},{"pid":"D11","num":11,"team":"def","x":35.0,"y":47.5},{"pid":"D10","num":10,"team":"def","x":44.1,"y":35.7},{"pid":"D22","num":22,"team":"def","x":56.1,"y":20.5},{"pid":"D4","num":4,"team":"def","x":60.6,"y":35.5}]},{"t":0.4,"ball":{"x":41.4,"y":27.5},"players":[{"pid":"A1","num":1,"team":"att","x":9.7,"y":34.1},{"pid":"A4","num":4,"team":"att","x":29.3,"y":32.5},{"pid":"A9","num":9,"team":"att","x":53.8,"y":36.5},{"pid":"A11","num":11,"team":"att","x":41.0,"y":48.0},{"pid":"A19","num":19,"team":"att","x":41.7,"y":30.8},{"pid":"A5","num":5,"team":"att","x":38.0,"y":52.4},{"pid":"A12","num":12,"team":"att","x":30.1,"y":44.9},{"pid":"A25","num":25,"team":"att","x":39.5,"y":35.1},{"pid":"A30","num":30,"team":"att","x":57.8,"y":13.0},{"pid":"A27","num":27,"team":"att","x":59.9,"y":22.2},{"pid":"D1","num":1,"team":"def","x":87.2,"y":36.5},{"pid":"D7","num":7,"team":"def","x":44.1,"y":47.7},{"pid":"D33","num":33,"team":"def","x":30.5,"y":32.5},{"pid":"D30","num":30,"team":"def","x":61.2,"y":26.4},{"pid":"D8","num":8,"team":"def","x":42.2,"y":31.9},{"pid":"D20","num":20,"team":"def","x":58.6,"y":42.1},{"pid":"D23","num":23,"team":"def","x":50.6,"y":43.7},{"pid":"D11","num":11,"team":"def","x":35.3,"y":47.3},{"pid":"D10","num":10,"team":"def","x":44.2,"y":35.2},{"pid":"D22","num":22,"team":"def","x":56.4,"y":20.1},{"pid":"D4","num":4,"team":"def","x":60.9,"y":35.2}]},{"t":0.5,"ball":{"x":41.4,"y":26.7},"players":[{"pid":"A1","num":1,"team":"att","x":9.8,"y":34.0},{"pid":"A4","num":4,"team":"att","x":29.6,"y":32.3},{"pid":"A9","num":9,"team":"att","x":54.1,"y":36.3},{"pid":"A11","num":11,"team":"att","x":41.2,"y":47.8},{"pid":"A19","num":19,"team":"att","x":41.7,"y":30.0},{"pid":"A5","num":5,"team":"att","x":38.2,"y":52.3},{"pid":"A12","num":12,"team":"att","x":30.4,"y":44.8},{"pid":"A25","num":25,"team":"att","x":39.6,"y":35.0},{"pid":"A30","num":30,"team":"att","x":58.1,"y":12.6},{"pid":"A27","num":27,"team":"att","x":60.1,"y":21.8},{"pid":"D1","num":1,"team":"def","x":87.4,"y":36.4},{"pid":"D7","num":7,"team":"def","x":44.4,"y":47.5},{"pid":"D33","num":33,"team":"def","x":30.7,"y":32.5},{"pid":"D30","num":30,"team":"def","x":61.4,"y":25.9},{"pid":"D8","num":8,"team":"def","x":42.3,"y":31.3},{"pid":"D20","num":20,"team":"def","x":58.9,"y":41.7},{"pid":"D23","num":23,"team":"def","x":51.0,"y":43.6},{"pid":"D11","num":11,"team":"def","x":35.5,"y":47.1},{"pid":"D10","num":10,"team":"def","x":44.4,"y":34.6},{"pid":"D22","num":22,"team":"def","x":56.7,"y":19.8},{"pid":"D4","num":4,"team":"def","x":61.3,"y":35.0}]},{"t":0.6,"ball":{"x":41.4,"y":25.9},"players":[{"pid":"A1","num":1,"team":"att","x":10.0,"y":33.9},{"pid":"A4","num":4,"team":"att","x":29.8,"y":32.0},{"pid":"A9","num":9,"team":"att","x":54.5,"y":36.2},{"pid":"A11","num":11,"team":"att","x":41.3,"y":47.6},{"pid":"A19","num":19,"team":"att","x":41.7,"y":29.2},{"pid":"A5","num":5,"team":"att","x":38.6,"y":52.2},{"pid":"A12","num":12,"team":"att","x":30.6,"y":44.6},{"pid":"A25","num":25,"team":"att","x":39.7,"y":34.8},{"pid":"A30","num":30,"team":"att","x":58.3,"y":12.2},{"pid":"A27","num":27,"team":"att","x":60.3,"y":21.4},{"pid":"D1","num":1,"team":"def","x":87.5,"y":36.4},{"pid":"D7","num":7,"team":"def","x":44.6,"y":47.2},{"pid":"D33","num":33,"team":"def","x":31.0,"y":32.5},{"pid":"D30","num":30,"team":"def","x":61.5,"y":25.4},{"pid":"D8","num":8,"team":"def","x":42.4,"y":30.8},{"pid":"D20","num":20,"team":"def","x":59.1,"y":41.3},{"pid":"D23","num":23,"team":"def","x":51.5,"y":43.5},{"pid":"D11","num":11,"team":"def","x":35.8,"y":47.0},{"pid":"D10","num":10,"team":"def","x":44.5,"y":34.1},{"pid":"D22","num":22,"team":"def","x":56.9,"y":19.5},{"pid":"D4","num":4,"team":"def","x":61.6,"y":34.7}]},{"t":0.7,"ball":{"x":41.4,"y":25.3},"players":[{"pid":"A1","num":1,"team":"att","x":10.1,"y":33.8},{"pid":"A4","num":4,"team":"att","x":30.0,"y":31.7},{"pid":"A9","num":9,"team":"att","x":54.8,"y":36.1},{"pid":"A11","num":11,"team":"att","x":41.4,"y":47.4},{"pid":"A19","num":19,"team":"att","x":41.7,"y":28.4},{"pid":"A5","num":5,"team":"att","x":38.9,"y":52.2},{"pid":"A12","num":12,"team":"att","x":30.8,"y":44.4},{"pid":"A25","num":25,"team":"att","x":39.7,"y":34.6},{"pid":"A30","num":30,"team":"att","x":58.5,"y":11.8},{"pid":"A27","num":27,"team":"att","x":60.4,"y":21.1},{"pid":"D1","num":1,"team":"def","x":87.7,"y":36.3},{"pid":"D7","num":7,"team":"def","x":44.9,"y":47.0},{"pid":"D33","num":33,"team":"def","x":31.2,"y":32.4},{"pid":"D30","num":30,"team":"def","x":61.7,"y":25.0},{"pid":"D8","num":8,"team":"def","x":42.5,"y":30.2},{"pid":"D20","num":20,"team":"def","x":59.4,"y":40.9},{"pid":"D23","num":23,"team":"def","x":51.9,"y":43.3},{"pid":"D11","num":11,"team":"def","x":36.0,"y":46.8},{"pid":"D10","num":10,"team":"def","x":44.7,"y":33.6},{"pid":"D22","num":22,"team":"def","x":57.1,"y":19.1},{"pid":"D4","num":4,"team":"def","x":61.9,"y":34.4}]},{"t":0.8,"ball":{"x":41.4,"y":24.6},"players":[{"pid":"A1","num":1,"team":"att","x":10.2,"y":33.7},{"pid":"A4","num":4,"team":"att","x":30.2,"y":31.4},{"pid":"A9","num":9,"team":"att","x":55.2,"y":36.0},{"pid":"A11","num":11,"team":"att","x":41.6,"y":47.2},{"pid":"A19","num":19,"team":"att","x":41.6,"y":27.6},{"pid":"A5","num":5,"team":"att","x":39.2,"y":52.1},{"pid":"A12","num":12,"team":"att","x":31.0,"y":44.3},{"pid":"A25","num":25,"team":"att","x":39.8,"y":34.4},{"pid":"A30","num":30,"team":"att","x":58.7,"y":11.3},{"pid":"A27","num":27,"team":"at